{"aggregation_rule":"ORDERED_BOOLEAN_PRECEDENCE_V0","layer_type":"READ_ONLY_CONSUMER_VIEW_MODEL","race_count":1,"races":[{"decision_summary":{"conditional_review":[{"failure_world_state_codes":[],"horse_id":"SYN-H02","horse_name":"Synthetic Beta","horse_no":2,"positive_world_state_codes":["WORLD_TARGET_ROLE_REPRODUCED","WORLD_EARLY_PRESSURE_EASES","WORLD_CAN_RATE_PATH_AVAILABLE"],"reason_codes":["ABILITY_CLEAN_NOT_AVAILABLE","PRIMARY_ROLE_REACHABLE","CONDITIONAL_MEDIUM_FIRST_TURN_COST","CONDITIONAL_MEDIUM_PRESSURE_RIVAL","CONDITIONAL_CAN_RATE_PATH_AVAILABLE"]}],"display_order_rule":"OFFICIAL_HORSE_NO; NOT_REVIEW_ORDER","fragile_or_downgrade":[{"failure_world_state_codes":["FAILURE_ROLE_BAND_MISSED","FAILURE_NONLEAD_POSITION_FORCED","FAILURE_EARLY_CONFLICT_ESCALATES","FAILURE_FIRST_TURN_COST_REALIZED","FAILURE_CURRENT_CONDITION_FAILS"],"horse_id":"SYN-H03","horse_name":"Synthetic Gamma","horse_no":3,"positive_world_state_codes":["WORLD_TARGET_ROLE_REPRODUCED"],"reason_codes":["ABILITY_CLEAN_NOT_AVAILABLE","PRIMARY_ROLE_REACHABLE","FRAGILE_ROLE_RANGE_NARROW","FRAGILE_LEAD_DEPENDENCY_POSSIBLE","FRAGILE_QUEUE_HIGH_CONFLICT","FRAGILE_FIRST_TURN_COST_HIGH","FRAGILE_CURRENT_CONDITION_ADVERSE"]}],"insufficient_review":[{"failure_world_state_codes":[],"horse_id":"SYN-H04","horse_name":"Synthetic Delta","horse_no":4,"positive_world_state_codes":[],"reason_codes":["ABILITY_CLEAN_NOT_AVAILABLE","INSUFFICIENT_ROLE_CORE","INSUFFICIENT_QUEUE_CONTEXT","CONDITION_CURRENT_NOT_AVAILABLE"]}],"key_world_states":[{"code":"WORLD_TARGET_ROLE_REPRODUCED","description":"今回も対象roleと想定位置帯を再現できる","horse_nos":[1,2,3],"state_kind":"UPSIDE"},{"code":"WORLD_QUEUE_COST_STAYS_LOW","description":"序盤のQueue負荷が低いまま推移する","horse_nos":[1],"state_kind":"UPSIDE"},{"code":"WORLD_EARLY_PRESSURE_EASES","description":"序盤の位置取り圧が緩和される","horse_nos":[2],"state_kind":"UPSIDE"},{"code":"WORLD_CAN_RATE_PATH_AVAILABLE","description":"控える選択肢が機能して位置依存を弱める","horse_nos":[2],"state_kind":"UPSIDE"},{"code":"WORLD_CURRENT_CONDITION_SUPPORT_PERSISTS","description":"直接観測された状態面の支えが維持される","horse_nos":[1],"state_kind":"UPSIDE"},{"code":"FAILURE_ROLE_BAND_MISSED","description":"必要な位置帯へ入れない","horse_nos":[3],"state_kind":"FAILURE"},{"code":"FAILURE_NONLEAD_POSITION_FORCED","description":"主導権を取れず依存する位置を失う","horse_nos":[3],"state_kind":"FAILURE"},{"code":"FAILURE_EARLY_CONFLICT_ESCALATES","description":"序盤のQueue競合が強まる","horse_nos":[3],"state_kind":"FAILURE"},{"code":"FAILURE_FIRST_TURN_COST_REALIZED","description":"1角までの位置確保コストが顕在化する","horse_nos":[3],"state_kind":"FAILURE"},{"code":"FAILURE_CURRENT_CONDITION_FAILS","description":"状態面の逆風がレース中の反応を制限する","horse_nos":[3],"state_kind":"FAILURE"}],"primary_review":[{"failure_world_state_codes":[],"horse_id":"SYN-H01","horse_name":"Synthetic Alpha","horse_no":1,"positive_world_state_codes":["WORLD_TARGET_ROLE_REPRODUCED","WORLD_QUEUE_COST_STAYS_LOW","WORLD_CURRENT_CONDITION_SUPPORT_PERSISTS"],"reason_codes":["ABILITY_CLEAN_NOT_AVAILABLE","PRIMARY_ROLE_REACHABLE","PRIMARY_QUEUE_SUPPORTIVE","CURRENT_CONDITION_SUPPORTIVE"]}]},"display_order":1,"evidence_details":[{"detail_ref":"#detail-r7-SYN-R01-h7-SYN-H01","horse_id":"SYN-H01","horse_name":"Synthetic Alpha","horse_no":1,"items":[{"evidence_id":"A-COND-01","label":"current-condition observation","section":"CONDITION","source_note":"Synthetic direct observation.","status":"OBSERVED","value":"supportive"},{"evidence_id":"A-QUEUE-01","label":"first-turn burden and neighbor context","section":"QUEUE","source_note":"Synthetic Queue evidence.","status":"DERIVED","value":"low burden"},{"evidence_id":"A-ROLE-01","label":"target-context role","section":"ROLE","source_note":"Synthetic Horsecard role evidence.","status":"OBSERVED","value":"front"},{"evidence_id":"A-ROLE-02","label":"expected position band","section":"ROUTE","source_note":"Synthetic route/role projection.","status":"DERIVED","value":"front"}]},{"detail_ref":"#detail-r7-SYN-R01-h7-SYN-H02","horse_id":"SYN-H02","horse_name":"Synthetic Beta","horse_no":2,"items":[{"evidence_id":"B-COND-01","label":"current-condition observation","section":"CONDITION","source_note":"Synthetic direct observation.","status":"OBSERVED","value":"neutral"},{"evidence_id":"B-QUEUE-01","label":"first-turn position cost","section":"QUEUE","source_note":"Synthetic Queue projection.","status":"DERIVED","value":"medium"},{"evidence_id":"B-RIVAL-01","label":"pressure rival","section":"QUEUE","source_note":"Synthetic pair conflict evidence.","status":"DERIVED","value":"medium conflict"},{"evidence_id":"B-ROLE-01","label":"role range","section":"ROLE","source_note":"Synthetic Horsecard role evidence.","status":"OBSERVED","value":"front to stalking"}]},{"detail_ref":"#detail-r7-SYN-R01-h7-SYN-H03","horse_id":"SYN-H03","horse_name":"Synthetic Gamma","horse_no":3,"items":[{"evidence_id":"C-COND-01","label":"current-condition observation","section":"CONDITION","source_note":"Synthetic direct observation.","status":"OBSERVED","value":"adverse"},{"evidence_id":"C-QUEUE-01","label":"first-turn position cost","section":"QUEUE","source_note":"Synthetic Queue projection.","status":"DERIVED","value":"high"},{"evidence_id":"C-RIVAL-01","label":"pressure rival","section":"QUEUE","source_note":"Synthetic pair conflict evidence.","status":"DERIVED","value":"high conflict"},{"evidence_id":"C-ROLE-01","label":"role dependency","section":"ROLE","source_note":"Synthetic Horsecard role evidence.","status":"OBSERVED","value":"narrow lead role"}]},{"detail_ref":"#detail-r7-SYN-R01-h7-SYN-H04","horse_id":"SYN-H04","horse_name":"Synthetic Delta","horse_no":4,"items":[{"evidence_id":"D-MISSING-01","label":"missing structured evidence","section":"OTHER","source_note":"Missingness is retained, not imputed.","status":"UNOBSERVED","value":"not available in synthetic source"}]}],"horse_summaries":[{"ability_status":{"availability":"NOT_AVAILABLE","evidence_count":0,"reason_codes":["ABILITY_CLEAN_NOT_AVAILABLE"],"value":"UNKNOWN"},"basics":{"age":4,"assigned_weight":"57.0","frame_no":1,"horse_name":"Synthetic Alpha","horse_no":1,"jockey":"Fixture Jockey A","sex":"M","trainer":"Fixture Trainer A"},"classification":"PRIMARY_REVIEW","classification_semantics":"REVIEW_PRIORITY_ONLY","confidence":{"available_dimensions":["ROLE","QUEUE","CONDITION"],"basis":"SUMMARY_EVIDENCE_AVAILABILITY_ONLY; UPSTREAM_CONFIDENCE_UNUSED; CAPPED_AT_MEDIUM","upstream_confidence_used":false,"value":"MEDIUM"},"current_condition_fit":{"availability":"AVAILABLE","evidence_count":1,"source_status":"OBSERVED","value":"SUPPORTIVE"},"detail_ref":"#detail-r7-SYN-R01-h7-SYN-H01","evidence_count":{"classification_uses_count":false,"current_condition":1,"detail_items":4,"evidence_ids_by_dimension":{"current_condition":["A-COND-01"],"queue":["A-QUEUE-01"],"role":["A-ROLE-01","A-ROLE-02"]},"queue":1,"role":2,"total_distinct":4},"failure_world_state":"想定位置帯に届かない、またはQueue・状態面の肯定条件が成立しない","fragility_triggers":[],"horse_id":"SYN-H01","queue_fit":{"availability":"AVAILABLE","evidence_count":1,"value":"SUPPORTIVE"},"reason_codes":["ABILITY_CLEAN_NOT_AVAILABLE","PRIMARY_ROLE_REACHABLE","PRIMARY_QUEUE_SUPPORTIVE","CURRENT_CONDITION_SUPPORTIVE"],"role_expected_position":{"availability":"AVAILABLE","expected_position":"FRONT","position_flexibility":"FLEXIBLE","role":"FRONT","role_range":"MULTIPLE"},"upside_triggers":[{"code":"WORLD_TARGET_ROLE_REPRODUCED","description":"今回も対象roleと想定位置帯を再現できる","evidence_count":2,"evidence_ids":["A-ROLE-01","A-ROLE-02"],"kind":"UPSIDE"},{"code":"WORLD_QUEUE_COST_STAYS_LOW","description":"序盤のQueue負荷が低いまま推移する","evidence_count":1,"evidence_ids":["A-QUEUE-01"],"kind":"UPSIDE"},{"code":"WORLD_CURRENT_CONDITION_SUPPORT_PERSISTS","description":"直接観測された状態面の支えが維持される","evidence_count":1,"evidence_ids":["A-COND-01"],"kind":"UPSIDE"}],"winning_or_in_the_money_world_state":"今回も対象roleと想定位置帯を再現できる / 序盤のQueue負荷が低いまま推移する / 直接観測された状態面の支えが維持される"},{"ability_status":{"availability":"NOT_AVAILABLE","evidence_count":0,"reason_codes":["ABILITY_CLEAN_NOT_AVAILABLE"],"value":"UNKNOWN"},"basics":{"age":4,"assigned_weight":"55.0","frame_no":2,"horse_name":"Synthetic Beta","horse_no":2,"jockey":"Fixture Jockey B","sex":"F","trainer":"Fixture Trainer B"},"classification":"CONDITIONAL_REVIEW","classification_semantics":"REVIEW_PRIORITY_ONLY","confidence":{"available_dimensions":["ROLE","QUEUE","CONDITION"],"basis":"SUMMARY_EVIDENCE_AVAILABILITY_ONLY; UPSTREAM_CONFIDENCE_UNUSED; CAPPED_AT_MEDIUM","upstream_confidence_used":false,"value":"MEDIUM"},"current_condition_fit":{"availability":"AVAILABLE","evidence_count":1,"source_status":"OBSERVED","value":"NEUTRAL"},"detail_ref":"#detail-r7-SYN-R01-h7-SYN-H02","evidence_count":{"classification_uses_count":false,"current_condition":1,"detail_items":4,"evidence_ids_by_dimension":{"current_condition":["B-COND-01"],"queue":["B-QUEUE-01","B-RIVAL-01"],"role":["B-ROLE-01"]},"queue":2,"role":1,"total_distinct":4},"failure_world_state":"想定位置帯に届かない、またはQueue・状態面の肯定条件が成立しない","fragility_triggers":[],"horse_id":"SYN-H02","queue_fit":{"availability":"AVAILABLE","evidence_count":2,"value":"CONDITIONAL"},"reason_codes":["ABILITY_CLEAN_NOT_AVAILABLE","PRIMARY_ROLE_REACHABLE","CONDITIONAL_MEDIUM_FIRST_TURN_COST","CONDITIONAL_MEDIUM_PRESSURE_RIVAL","CONDITIONAL_CAN_RATE_PATH_AVAILABLE"],"role_expected_position":{"availability":"AVAILABLE","expected_position":"STALKING","position_flexibility":"FLEXIBLE","role":"STALKING","role_range":"MULTIPLE"},"upside_triggers":[{"code":"WORLD_TARGET_ROLE_REPRODUCED","description":"今回も対象roleと想定位置帯を再現できる","evidence_count":1,"evidence_ids":["B-ROLE-01"],"kind":"UPSIDE"},{"code":"WORLD_EARLY_PRESSURE_EASES","description":"序盤の位置取り圧が緩和される","evidence_count":2,"evidence_ids":["B-QUEUE-01","B-RIVAL-01"],"kind":"UPSIDE"},{"code":"WORLD_CAN_RATE_PATH_AVAILABLE","description":"控える選択肢が機能して位置依存を弱める","evidence_count":1,"evidence_ids":["B-ROLE-01"],"kind":"UPSIDE"}],"winning_or_in_the_money_world_state":"今回も対象roleと想定位置帯を再現できる / 序盤の位置取り圧が緩和される / 控える選択肢が機能して位置依存を弱める"},{"ability_status":{"availability":"NO